{
  "table_id": "product_registry_hs96_v1",
  "schema_version": "1.0.0",
  "primary_key": [
    "hs96",
    "list_name"
  ],
  "columns": {
    "hs96": "String",
    "list_name": "String",
    "green_weight": "Float64",
    "upstream_weight": "Float64",
    "green_upstream_weight": "Float64",
    "mapped_hs07_count": "UInt16",
    "green_hs07_count": "UInt16",
    "overlap_total_exports_usd": "Float64",
    "overlap_green_exports_usd": "Float64",
    "weight_method": "String",
    "code_share_fallback": "Boolean",
    "bec_mapping_count": "UInt16",
    "ambiguous_bec_mapping": "Boolean",
    "bec_unmapped": "Boolean",
    "bec_uses": "String",
    "source_hs_revision": "String",
    "target_hs_revision": "String",
    "overlap_start_year": "Int16",
    "overlap_end_year": "Int16",
    "concordance_source_sha256": "String",
    "bec_source_sha256": "String",
    "wits_bec_source_sha256": "String",
    "baci_overlap_source_sha256": "String",
    "review_status": "String",
    "category_apc_weight": "Float64",
    "category_cre_weight": "Float64",
    "category_epp_weight": "Float64",
    "category_hem_weight": "Float64",
    "category_mon_weight": "Float64",
    "category_nrp_weight": "Float64",
    "category_nva_weight": "Float64",
    "category_rep_weight": "Float64",
    "category_swm_weight": "Float64",
    "category_swr_weight": "Float64",
    "category_wat_weight": "Float64",
    "category_apec_weight": "Float64"
  },
  "units": {
    "green_weight": "fraction",
    "upstream_weight": "fraction",
    "green_upstream_weight": "fraction",
    "overlap_total_exports_usd": "current_USD",
    "overlap_green_exports_usd": "current_USD",
    "category_apc_weight": "fraction",
    "category_cre_weight": "fraction",
    "category_epp_weight": "fraction",
    "category_hem_weight": "fraction",
    "category_mon_weight": "fraction",
    "category_nrp_weight": "fraction",
    "category_nva_weight": "fraction",
    "category_rep_weight": "fraction",
    "category_swm_weight": "fraction",
    "category_swr_weight": "fraction",
    "category_wat_weight": "fraction",
    "category_apec_weight": "fraction"
  },
  "zero_semantics": {
    "green_weight": "mapped_HS07_codes_have_zero_membership_weight_for_this_list",
    "upstream_weight": "no_official_BEC_mapping_is_intermediate_or_capital",
    "green_upstream_weight": "green_or_upstream_fraction_is_zero",
    "overlap_total_exports_usd": "no_reported_global_BACI_exports_in_2007_2010",
    "overlap_green_exports_usd": "no_reported_green_mapped_exports_in_2007_2010"
  },
  "transformations": [
    "official_wits_hs2007_to_hs1996_pairs",
    "global_baci_hs2007_exports_summed_over_2007_2010",
    "trade_overlap_weight_with_code_share_fallback_only_for_zero_denominator",
    "unsd_one_to_many_bec_use_fraction",
    "category_weights_cannot_exceed_total_green_weight"
  ]
}
