{
  "table_id": "model_estimate",
  "schema_version": "1.0.0",
  "primary_key": ["run_id", "estimator", "analysis_family", "outcome_id", "horizon", "gad_version", "sample_version", "term"],
  "columns": {
    "run_id": "String",
    "spec_id": "String",
    "input_authority_hash": "String",
    "git_commit": "String",
    "renv_lock_sha256": "String",
    "evidence_policy_sha256": "String",
    "created_at_utc": "String",
    "year_min": "Int16",
    "year_max": "Int16",
    "r_version": "String",
    "python_version": "String",
    "julia_version": "String",
    "package_versions_json": "String",
    "random_seed": "UInt64",
    "ssc_config": "String",
    "reference_distribution": "String",
    "reference_df": "Float64",
    "estimator": "String",
    "analysis_family": "String",
    "outcome_id": "String",
    "horizon": "Int16",
    "gad_version": "String",
    "sample_version": "String",
    "term": "String",
    "estimate": "Float64",
    "std_error": "Float64",
    "conf_low": "Float64",
    "conf_high": "Float64",
    "p_value": "Float64",
    "wild_conf_low": "Float64",
    "wild_conf_high": "Float64",
    "wild_p_value": "Float64",
    "wild_draws": "UInt32",
    "wild_seed": "UInt64",
    "n": "UInt32",
    "economies": "UInt16",
    "clusters": "UInt16",
    "first_stage_status": "String",
    "inference_status": "String"
  },
  "units": {
    "horizon": "years_after_treatment",
    "estimate": "outcome_units_per_frozen_regressor_unit",
    "std_error": "outcome_units_per_frozen_regressor_unit",
    "conf_low": "outcome_units_per_frozen_regressor_unit",
    "conf_high": "outcome_units_per_frozen_regressor_unit",
    "p_value": "probability",
    "wild_conf_low": "outcome_units_per_frozen_regressor_unit",
    "wild_conf_high": "outcome_units_per_frozen_regressor_unit",
    "wild_p_value": "probability",
    "wild_draws": "bootstrap_draws",
    "wild_seed": "deterministic_integer_seed"
  },
  "period": null,
  "zero_semantics": {
    "estimate": "valid_exact_zero_coefficient",
    "p_value": "valid_numerical_underflow_to_zero",
    "wild_p_value": "valid_bootstrap_probability_zero_when_bootstrap_is_required"
  },
  "null_semantics": {
    "wild_conf_low": "nonnull_when_inference_status=wild_bootstrap_required; null_when_wild_bootstrap_unbounded_or_not_required",
    "wild_conf_high": "nonnull_when_inference_status=wild_bootstrap_required; null_when_wild_bootstrap_unbounded_or_not_required",
    "wild_p_value": "nonnull_when_inference_status_is_wild_bootstrap_required_or_wild_bootstrap_unbounded; otherwise_null",
    "wild_draws": "nonnull_when_inference_status_is_wild_bootstrap_required_or_wild_bootstrap_unbounded; otherwise_null",
    "wild_seed": "nonnull_when_inference_status_is_wild_bootstrap_required_or_wild_bootstrap_unbounded; otherwise_null"
  },
  "transformations": [
    "continuous_interaction_local_projection_with_economy_and_treatment_year_fixed_effects",
    "lp_iv_instruments_gimc_and_gimc_times_gad_with_Z_and_Z_times_gad",
    "never_replace_wild_bootstrap_fields_with_cluster_robust_values",
    "encode_a_two_sided_unbounded_wild_interval_as_null_bounds_with_inference_status_wild_bootstrap_unbounded"
  ]
}
