{
  "table_id": "model_panel",
  "schema_version": "1.0.0",
  "primary_key": ["economy_id", "treatment_time", "horizon", "outcome_id", "gad_version", "sample_version"],
  "columns": {
    "economy_id": "String",
    "treatment_time": "Int16",
    "horizon": "Int16",
    "outcome_id": "String",
    "gad_version": "String",
    "sample_version": "String",
    "gad_time": "Int16",
    "control_time": "Int16",
    "baseline_outcome_time": "Int16",
    "outcome_time": "Int16",
    "gimc": "Float64",
    "gimc_p01_p99": "Float64",
    "gad_lag": "Float64",
    "gad_lag_p01_p99": "Float64",
    "Z": "Float64",
    "Z_p01_p99": "Float64",
    "Z_GAD": "Float64",
    "Z_GAD_p01_p99": "Float64",
    "CMZ": "Float64",
    "CMZ_p01_p99": "Float64",
    "baseline_outcome": "Float64",
    "future_outcome": "Float64",
    "delta_outcome": "Float64",
    "rca_eligible_products": "UInt32",
    "rca_entered_products": "UInt32",
    "renewable_energy_consumption_share": "Float64",
    "renewable_energy_consumption_share_analysis": "Float64",
    "renewable_energy_consumption_share_analysis_p01_p99": "Float64",
    "renewable_energy_consumption_share_interpolated": "Boolean",
    "trade_openness_percent_gdp": "Float64",
    "trade_openness_percent_gdp_analysis": "Float64",
    "trade_openness_percent_gdp_analysis_p01_p99": "Float64",
    "trade_openness_percent_gdp_interpolated": "Boolean",
    "industry_value_added_share": "Float64",
    "industry_value_added_share_analysis": "Float64",
    "industry_value_added_share_analysis_p01_p99": "Float64",
    "industry_value_added_share_interpolated": "Boolean",
    "gdp_per_capita_current_usd": "Float64",
    "gdp_per_capita_current_usd_analysis": "Float64",
    "gdp_per_capita_current_usd_analysis_p01_p99": "Float64",
    "gdp_per_capita_current_usd_interpolated": "Boolean",
    "interpolated_control": "Boolean",
    "outcome_coverage_eligible": "Boolean",
    "confirmatory_iv_eligible": "Boolean",
    "core_eligible": "Boolean",
    "lite_eligible": "Boolean",
    "provisional_core": "Boolean",
    "descriptive_only": "Boolean",
    "threshold_selection_only": "Boolean",
    "negative_shock_sample": "Boolean",
    "gad_interpolated": "Boolean",
    "outcome_interpolated": "Boolean",
    "source_outcome_materialized": "Boolean",
    "gad_scaler_hash": "String",
    "regression_bounds_hash": "String",
    "giu_scaler_hash": "String"
  },
  "units": {
    "treatment_time": "calendar_year",
    "horizon": "years_after_treatment",
    "gad_time": "calendar_year",
    "control_time": "calendar_year",
    "baseline_outcome_time": "calendar_year",
    "outcome_time": "calendar_year",
    "gimc": "frozen_robust_z_score",
    "gad_lag": "nonnegative_frozen_robust_z_score_debt",
    "Z": "fixed_share_weighted_partner_shock",
    "Z_GAD": "shock_times_lagged_mapped_GAD",
    "CMZ": "five_term_decayed_shock_rank_sum",
    "delta_outcome": "outcome_specific_change_or_precomputed_future_entry_rate",
    "rca_eligible_products": "baseline_non_RCA_green_products",
    "rca_entered_products": "baseline_non_RCA_products_with_future_RCA_at_least_one"
  },
  "period": null,
  "zero_semantics": {
    "gimc": "exact_scaled_zero",
    "gad_lag": "explicit_nonnegative_recursion_floor",
    "Z": "complete_fixed_share_contributions_sum_exactly_to_zero",
    "Z_GAD": "complete_Z_or_lagged_GAD_is_exactly_zero",
    "CMZ": "five_complete_terms_sum_exactly_to_zero",
    "delta_outcome": "no_change_or_zero_precomputed_rate"
  },
  "null_semantics": {
    "CMZ": "null_when_fewer_than_five_complete_terms",
    "CMZ_p01_p99": "null_exactly_when_CMZ_is_null",
    "baseline_outcome": "null_for_precomputed_future_RCA_entry_and_GIU_rows",
    "rca_eligible_products": "nonnull_only_for_precomputed_future_RCA_entry_rows",
    "rca_entered_products": "nonnull_only_for_precomputed_future_RCA_entry_rows",
    "renewable_energy_consumption_share": "null_only_in_bounded_control_rows_filled_by_one_year_interpolation",
    "trade_openness_percent_gdp": "null_only_in_bounded_control_rows_filled_by_one_year_interpolation",
    "industry_value_added_share": "null_only_in_bounded_control_rows_filled_by_one_year_interpolation",
    "gdp_per_capita_current_usd": "null_only_in_bounded_control_rows_filled_by_one_year_interpolation"
  },
  "transformations": [
    "use_current_treatment_GIMC_and_main_0_0001_fixed_share_Z_at_t",
    "use_only_mapped_GAD_and_controls_and_baseline_outcome_at_t_minus_one",
    "use_outcome_at_t_plus_h_and_never_future_shocks_or_current_import_shares",
    "continuous_outcome_change_is_Y_t_plus_h_minus_Y_t_minus_one",
    "future_RCA_entry_rate_is_already_horizon_specific_and_is_not_differenced_twice",
    "complete_case_and_bounded_one_year_control_interpolation_are_separate_sample_versions",
    "raw_control_columns_are_preserved_and_only_analysis_copies_can_be_interpolated",
    "regression_bounds_are_fit_once_before_horizon_duplication_and_raw_columns_are_unchanged",
    "delta_outcome_is_marked_no_regression_clipping",
    "negative_shock_samples_require_Z_less_than_zero_and_keep_unmultiplied_outcome_changes",
    "environmental_horizon_zero_and_2023_2024_are_descriptive_only",
    "never_substitute_gad_lite_for_a_frozen_outcome_mapping"
  ]
}
